category,attribute,description
"장점","프로젝트 리딩","기획부터 개발, 배포까지 전 과정에 주도적으로 참여하여 프로젝트의 전체 흐름을 파악하고 성공적으로 완수한 경험이 있습니다."
"장점","성능 최적화","대규모 트래픽 환경에서 쿼리 튜닝, 캐싱 전략 도입, 비동기 처리 등을 통해 시스템 응답 속도를 개선하고 서버 부하를 줄인 경험이 있습니다."
"장점","사용자 경험 개선","이미지 최적화, 웹 접근성 표준 준수, 재사용 가능한 컴포넌트 설계를 통해 사용자 친화적인 서비스를 구축하고 관련 지표를 개선했습니다."
"장점","소통 및 협업 능력","팀원들과의 정기적인 소통과 적극적인 피드백 수용을 통해 원활한 협업을 이끌고, 공동의 목표를 효율적으로 달성한 경험이 있습니다."
"장점","문제 해결 능력","서비스 운영 중 예상치 못한 장애가 발생했을 때, 로그 분석과 시스템 모니터링을 통해 신속하게 원인을 파악하고 해결책을 제시했습니다."
"장점","자기주도 학습","새로운 기술 스택이나 프레임워크가 필요할 때, 공식 문서와 강의를 통해 스스로 학습하여 실제 프로젝트에 성공적으로 적용한 경험이 있습니다."
"장점","리더십","팀 프로젝트에서 명확한 역할 분담과 현실적인 일정 관리를 통해 팀원들의 동기부여를 이끌고, 프로젝트를 성공적으로 마감했습니다."
"장점","체계적인 문서화","코드의 의도와 시스템 아키텍처를 명확하게 문서화하여 동료들의 온보딩 시간을 단축하고, 유지보수성과 협업 효율성을 높였습니다."
"장점","시간 관리 능력","여러 프로젝트를 동시에 진행하는 상황에서, 업무의 우선순위를 정하고 효율적으로 시간을 분배하여 모든 프로젝트의 마감 기한을 준수했습니다."
"장점","발표 및 설득력","기술적인 내용을 비전공자도 이해하기 쉽게 설명하고, 데이터에 기반한 근거를 제시하여 팀 내외부 이해관계자를 성공적으로 설득한 경험이 있습니다."
"장점","도전 정신","익숙하지 않은 도메인이나 기술 분야의 프로젝트에 자발적으로 참여하여, 새로운 지식을 습득하고 가시적인 성과를 만들어냈습니다."
"장점","강한 책임감","맡은 업무나 기능에 대해 오너십을 가지고, 예상치 못한 문제가 발생하더라도 끝까지 해결하여 안정적인 서비스를 제공했습니다."
"장점","기술 트렌드 민감도","최신 기술 동향과 개발자 컨퍼런스 내용을 꾸준히 파악하고, 팀 스터디를 통해 유용한 정보를 공유하여 팀의 기술력 향상에 기여했습니다."
"장점","피드백 수용 및 개선","동료의 코드 리뷰나 피드백을 비판이 아닌 성장의 기회로 여기고, 적극적으로 반영하여 코드 품질과 업무 방식을 개선한 경험이 있습니다."
"장점","데이터 기반 의사결정","로그 데이터나 사용자 행동 지표를 분석하여 서비스 개선 방향을 제안하고, A/B 테스트를 통해 가설을 검증하며 제품을 성장시켰습니다."
"단점","성과 강조 부족","프로젝트의 결과나 성과를 제시할 때, '매출 _N_% 상승' 이나 '응답 시간 _X_ms 단축'과 같은 수치적, 구체적 표현이 부족한 경향이 있습니다."
"단점","경험 구체성 부족","이력서에 다양한 기술 스택을 나열했지만, 각 기술을 어떤 문제 해결을 위해, 어느 정도 깊이로 사용했는지에 대한 구체적인 경험 서술이 미흡합니다."
"단점","완벽주의 경향","때때로 세부적인 부분에 과도하게 집중하여 전체적인 개발 일정이 지연된 경험이 있으며, 우선순위에 따른 업무 조율 능력을 개선 중입니다."
"단점","반복적인 표현 사용","유사한 경험이나 역량을 여러 항목에서 반복적으로 기술하여, 이력서 전반의 임팩트가 약화되고 강점이 명확하게 드러나지 않습니다."
"단점","자기소개서 내용 미흡","자기소개서의 내용이 추상적이거나 일반적인 이야기 위주로 구성되어, 지원자 본인의 차별화된 강점과 직무에 대한 기여 의지가 잘 드러나지 않습니다."
"단점","실무 운영 경험 부족","개인 프로젝트나 토이 프로젝트 경험은 다수 있으나, 실제 사용자가 있는 서비스를 상용 환경에서 배포하고 운영해 본 경험이 부족합니다."
"단점","특정 기술 편향","특정 언어와 프레임워크 사용을 선호하여, 프로젝트의 요구사항에 더 적합한 다른 기술적 대안을 탐색하는 데 소극적이었던 경험이 있습니다."
"단점","비즈니스 이해도","기술 구현 자체에 집중한 나머지, 해당 기능이 비즈니스 목표에 어떻게 기여하는지에 대한 이해와 고민이 부족했던 경우가 있습니다."
